{
    "$schema": "../schema/marketplace.schema.json",
    "name": "concrete-marketplace",
    "owner": {
        "name": "Concrete Security Team",
        "email": "contact@concrete-security.com"
    },
    "metadata": {
        "description": "Enterprise plugin directory for Concrete Security Claude Code skills, agents, and integrations",
        "version": "1.0.0",
        "pluginRoot": "./claude-plugins"
    },
    "plugins": [
        {
            "name": "tee-developer",
            "source": "./claude-plugins/tee-developer",
            "description": "Plugin for developing and testing Trusted Execution Environment (TEE) applications.",
            "version": "1.0.0",
            "author": {
                "name": "Concrete Security Team",
                "email": "contact@concrete-security.com"
            },
            "license": "",
            "repository": "https://github.com/concrete-security/concrete-marketplace",
            "keywords": [
                "TEE"
            ],
            "category": "development"
        },
        {
            "name": "tee-security-auditor",
            "source": "./claude-plugins/tee-security-auditor",
            "description": "Expert TEE security auditor for Intel TDX attestation, DCAP verification, EKM channel binding, and aTLS implementations.",
            "version": "1.0.0",
            "author": {
                "name": "Concrete Security Team",
                "email": "contact@concrete-security.com"
            },
            "license": "",
            "repository": "https://github.com/concrete-security/concrete-marketplace",
            "keywords": [
                "TEE",
                "TDX",
                "attestation",
                "DCAP",
                "security",
                "aTLS"
            ],
            "category": "security"
        }
    ]
}